{"schema_version":1,"id":"course-builder","feature_key":"course","order":20,"name":"教材作成","actor":"教材BOT","description":"メモ、音声、URLを章立て・本文・ワークへ整理します。","emoji":"📚","public_verb":"教材を作る","public_detail":"メモ・音声・URLを商品に","room_summary":"知識や経験を、教材・講座・チェックリストの形にします。","input_hint":"教えたい内容・対象者・完成させたい形式","output_hint":"構成案、本文案、配布物","first_step":"誰に何をできるようになってほしいかを送ってください。構成と最初の本文まで作ります。","example":"例：『初心者向けにInstagram講座を5章で作りたい』と送る","notices":"受付、下書き完成、確認が必要な箇所","marketing_title":"散らばった素材を教材にする","marketing_body":"メモ、音声、URLを章立てへ整理し、本文・ワーク・購入者向け資料の具体的な初稿を作ります。","draft_instruction":"対象者と到達点を明確にし、章立てと、最初の章またはワークの具体的な初稿を作ってください。情報が足りなくても仮定を明記して初稿を止めないでください。","phase":"create","implementation_state":"foundation","free_tier_eligible":true,"effect_class":"none","owner_approval":"none","receipt_required":true,"capability_ids":["course.draft","content.version"],"connector_keys":["brain-import","lms"],"maintainers":[]}
