{"schema_version":1,"id":"payment-assurance","feature_key":"pay","order":70,"name":"決済・失敗回収","actor":"入金確認BOT","description":"支払い、失敗、再決済、返金を外部記録と照合して確定します。","emoji":"💳","public_verb":"入金を確認","public_detail":"注文情報を照合して要確認を見つける","room_summary":"入金、未払い、返金など、お金の状態を見落とさないようにします。","input_hint":"確認したい商品・注文・期間・分かる範囲の記録","output_hint":"確認済み、未確認、対応が必要な項目","first_step":"確認したい注文や入金情報を送ってください。接続先の記録がなければ未確認として整理します。","example":"例：『注文Aは9月4日に4,980円入金、注文Bは不明』と送る","notices":"受付、照合完了、未確認・対応必要","marketing_title":"入金情報を未確認のまま確定しない","marketing_body":"提供された注文情報を確認済み・未確認・対応必要に分けます。決済事業者の記録を読めない時は、入金済みと断定しません。","draft_instruction":"提供された注文・入金情報だけを使い、確認済み・未確認・対応が必要な項目を表にしてください。決済事業者のreadbackがなければ入金済みと断定しないでください。","phase":"pay","implementation_state":"implemented_unconfigured","free_tier_eligible":true,"effect_class":"money","owner_approval":"per_invocation","receipt_required":true,"capability_ids":["payment.request","payment.readback","payment.refund"],"connector_keys":["telegram-stars","stripe"],"maintainers":[]}
