{"schema_version":1,"id":"entitlement-delivery","feature_key":"deliver","order":80,"name":"納品・権限付与","actor":"納品BOT","description":"購入確認後に教材、ツール、コミュニティ権限を付与・停止します。","emoji":"📦","public_verb":"商品を届ける","public_detail":"納品案内と確認手順を作る","room_summary":"購入後の案内、教材、権限を正しい相手へ届ける段取りを作ります。","input_hint":"購入者・注文・届ける物・提供条件","output_hint":"購入者向け案内文と納品チェックリスト","first_step":"購入者、届ける物、条件を送ってください。安全な納品手順と案内文を作ります。","example":"例：『購入者AさんへPDF教材とコミュニティ案内を届けたい』と送る","notices":"受付、納品手順完成、実行前の確認","marketing_title":"購入後の納品手順を間違えない",
  "marketing_body":"購入者、納品物、条件、期限を整理し、購入者向け案内文とチェックリストを作ります。権限付与や送信は別途承認後です。","draft_instruction":"購入者、納品物、提供条件、期限、確認手順を整理し、購入者向け案内文と納品チェックリストを作ってください。送信や権限変更は行わないでください。","phase":"deliver","implementation_state":"implemented_unconfigured","free_tier_eligible":true,"effect_class":"publish","owner_approval":"per_invocation","receipt_required":true,"capability_ids":["entitlement.grant","entitlement.verify","entitlement.revoke"],"connector_keys":["lms","software-license","community"],"maintainers":[]}
