{"schema_version":1,"id":"outcome-analytics","feature_key":"measure","order":90,"name":"施策・売上分析","actor":"分析BOT","description":"接触、購入、継続、返金を施策へ接続し、確定成果を比較します。","emoji":"📊","public_verb":"成果を測る","public_detail":"数字を要約して次の改善を決める","room_summary":"売上や反応をまとめ、次に直す場所を分かりやすくします。","input_hint":"見たい期間・商品・目標・分かる範囲の数字","output_hint":"数字の要約、変化、改善候補","first_step":"期間、目標、分かる数字を送ってください。次に直す一箇所まで絞ります。","example":"例：『今週は閲覧100、相談8、購入2。来週何を直す？』と送る","notices":"受付、分析完成、次の測定時期","marketing_title":"何が成果を生んだか整理する","marketing_body":"提供された売上や反応を要約し、変化、考えられる理由、次に直す一箇所、次回測る数字を示します。数字は捏造しません。","draft_instruction":"提供された数字だけを使い、結果の要約、変化、考えられる理由、次に直す一箇所、次回測る数字を示してください。存在しない数字を補わないでください。","phase":"measure","implementation_state":"foundation","free_tier_eligible":true,"effect_class":"none","owner_approval":"none","receipt_required":true,"capability_ids":["outcome.join","attribution.compare"],"connector_keys":["telegram","x","email","stripe","telegram-stars"],"maintainers":[]}
