{"schema_version":1,"id":"revenue-split","feature_key":"split","order":100,"name":"報酬分配","actor":"分配BOT","description":"確定売上と寄与証拠から関係者別の分配明細を作成します。","emoji":"🤝","public_verb":"報酬を分ける","public_detail":"分配を計算して検算を残す","room_summary":"共同販売の取り分と支払い予定を、曖昧にしないよう整理します。","input_hint":"売上・参加者・割合・手数料・端数ルール","output_hint":"分配計算、検算、確認事項","first_step":"売上額、相手、割合を送ってください。計算と検算を作り、送金は行いません。","example":"例：『売上10万円をAさん30%、私70%で整理して』と送る","notices":"受付、分配計算完成、送金前の確認","marketing_title":"確定した金額を正しく分ける","marketing_body":"売上、参加者、割合、手数料、端数を明示して分配を計算し、検算と確認事項を残します。送金は別途承認後です。","draft_instruction":"売上、参加者、割合、手数料、端数を明示して分配を計算し、検算と確認事項を示してください。情報不足時は式を提示し、送金は行わないでください。","phase":"settle","implementation_state":"foundation","free_tier_eligible":true,"effect_class":"money","owner_approval":"per_invocation","receipt_required":true,"capability_ids":["contribution.verify","settlement.calculate","settlement.record"],"connector_keys":["stripe","telegram-stars"],"maintainers":[]}
