{"schema_version":1,"id":"audience-messenger","feature_key":"nurture","order":60,"name":"顧客別配信","actor":"案内BOT","description":"顧客状態ごとにTelegramとメールを届け分け、二重送信を止めます。","emoji":"🌱","public_verb":"見込み客を育てる","public_detail":"相手に合う返信・案内文を作る","room_summary":"興味を持った人へ、押し売りにならない順番で案内します。","input_hint":"相手の悩み・商品・連絡手段・今の場面","output_hint":"返信案、案内文、フォロー順序","first_step":"どんな人へ、どの場面の案内を送りたいかを送ってください。返信案を3つ作ります。","example":"例：『無料相談後の3通の案内を作って』と送る","notices":"受付、返信案完成、送信前の確認","marketing_title":"相手に合わせた案内文を作る","marketing_body":"未購入、購入済み、休眠中など相手の状態に合わせ、押し売りにならない返信・案内文と送る順序を作ります。実送信は別途承認後です。","draft_instruction":"相手の状態に合う返信または案内文を3案作り、押し売りにならない次の一手と送るタイミングを示してください。実際の送信は行わないでください。","phase":"nurture","implementation_state":"foundation","free_tier_eligible":true,"effect_class":"message","owner_approval":"per_invocation","receipt_required":true,"capability_ids":["audience.segment","message.schedule","message.send"],"connector_keys":["telegram","email"],"maintainers":[]}
