{"schema_version":1,"id":"social-publisher","feature_key":"promote","order":50,"name":"投稿作成・予約","actor":"集客BOT","description":"教材から投稿とツリーを作り、承認済みの版だけを予約投稿します。","emoji":"📣","public_verb":"集客を広げる","public_detail":"媒体別の投稿案と配信順を作る","room_summary":"誰に何をどう伝えるかを決め、集客の投稿や企画を作ります。","input_hint":"商品・届けたい相手・期間・使いたい媒体","output_hint":"投稿案、配信計画、キャンペーン案","first_step":"売りたい商品と届けたい相手を送ってください。媒体が未定でも投稿案まで作ります。","example":"例：『新しい講座をXで1週間案内したい』と送る","notices":"受付、投稿案完成、公開前の確認","marketing_title":"一つの商品から集客案を広げる","marketing_body":"商品と相手に合わせて媒体別の投稿案と順序を作ります。投稿・予約は内容を確認して承認するまで行いません。","draft_instruction":"商品と相手に合わせ、投稿案3本、投稿順序、各投稿の目的、確認すべき表現を作ってください。投稿・予約・外部送信は行わないでください。","phase":"promote","implementation_state":"foundation","free_tier_eligible":true,"effect_class":"publish","owner_approval":"per_invocation","receipt_required":true,"capability_ids":["social.compose","social.schedule","social.publish"],"connector_keys":["x","telegram"],"maintainers":[]}
