{"schema_version":1,"id":"storefront-builder","feature_key":"store","order":40,"name":"LP・オファー作成","actor":"販売BOT","description":"商品説明、価格、特典、CTAを一つの販売ページ案へまとめます。","emoji":"🏪","public_verb":"売り場を作る","public_detail":"LP・価格・特典の下書きを作る","room_summary":"商品名、価格、説明を整理して、売り場の下書きを作ります。","input_hint":"商品名・内容・価格・販売相手","output_hint":"商品下書き、販売ページ案、発売手順","first_step":"商品と届けたい相手を送ってください。未定部分には仮案を入れて販売ページ初稿を作ります。","example":"例：『初心者向けInstagram教材を4,980円で売りたい』と送る","notices":"受付、下書き完成、公開前の確認","marketing_title":"売り場の下書きを組み立てる","marketing_body":"商品説明、対象者、価値、価格、特典、FAQ、購入ボタン文言を一枚の販売ページ初稿へまとめます。公開は別途承認後です。","draft_instruction":"商品名、対象者、悩み、約束する成果、内容、価格の考え方、FAQ、行動ボタンを含む販売ページ初稿を作ってください。公開や価格変更は行わないでください。","phase":"sell","implementation_state":"foundation","free_tier_eligible":true,"effect_class":"publish","owner_approval":"per_invocation","receipt_required":true,"capability_ids":["offer.compose","page.publish"],"connector_keys":["landing-page"],"maintainers":[]}
