{"schema_version":1,"id":"request-intake","feature_key":"request","order":10,"name":"依頼受付","actor":"受付BOT","description":"Telegramの依頼と素材を、実行可能な販売ジョブへ変換します。","emoji":"🧭","public_verb":"依頼を整理","public_detail":"ひとことを、実行できる仕事へ","room_summary":"散らかった相談や依頼を、次にやることへ整理します。","input_hint":"やりたいこと・期限・困っていること","output_hint":"優先順位つきの実行手順","first_step":"まず、やりたいことを普通の文章で送ってください。足りない情報は仮定を明記して進めます。","example":"例：『来週までに新講座を売り始めたい』と送る","notices":"受付、下書き完成、失敗・再確認","marketing_title":"ひとことで仕事を受け取る","marketing_body":"Telegramへやりたいことを送ると、目的・素材・期限を整理し、実行可能な依頼と最初の3手を作ります。","draft_instruction":"依頼を、目的・前提・不足情報・優先順位・今日からの3手へ整理してください。最初に、そのまま使える実行メモを完成させてください。","phase":"intake","implementation_state":"implemented_unconfigured","free_tier_eligible":true,"effect_class":"none","owner_approval":"none","receipt_required":false,"capability_ids":["request.normalize","asset.intake"],"connector_keys":["telegram"],"maintainers":[]}
