{"schema_version":1,"id":"fact-checker","feature_key":"check","order":30,"name":"出典確認","actor":"確認BOT","description":"主張、出典、確認結果、要修正箇所を版へ紐付けます。","emoji":"🔎","public_verb":"内容を検証","public_detail":"主張・出典・古い情報を確認","room_summary":"文章や企画の根拠、抜け、誤解されやすい表現を点検します。","input_hint":"確認したい文章・URL・商品案","output_hint":"確認済み、根拠不足、注意点、修正案","first_step":"確認したい内容を貼り付けてください。事実、未確認、提案を分けて返します。","example":"例：『この販売ページの表現を確認して』と内容を送る","notices":"受付、確認完了、根拠不足","marketing_title":"主張を一行ずつ検証する","marketing_body":"文章内の主張を確認済み・根拠不足・意見に分け、危険な断定と修正案を返します。出典は捏造しません。","draft_instruction":"文章内の主張を、確認できる・根拠不足・意見の3種類に分け、危険な断定と修正案を示してください。与えられていない出典や事実を作らないでください。","phase":"verify","implementation_state":"foundation","free_tier_eligible":true,"effect_class":"none","owner_approval":"none","receipt_required":true,"capability_ids":["claim.extract","source.verify"],"connector_keys":[],"maintainers":[]}
